<?xml version="1.0" encoding="utf-8"?>
<DictionaryConfiguration xmlns:xsi="http://www.w3.org/2001/XMLSchema-instance"
 xsi:noNamespaceSchemaLocation="../../Configuration/DictionaryConfiguration.xsd"
 xmlns:xsd="http://www.w3.org/2001/XMLSchema"
 name="Hybrid (complex forms as main entries and mini subentries)"
 version="-1"
 lastModified="2014-10-08"
 allPublications="true">
  <ConfigurationItem name="Main Entry" isEnabled="true" field="LexEntry" cssClassNameOverride="entry">
  <!-- using a different CSS Class for the main HeadWord and the HeadWords for subentries, references, and (variant|complex) forms
       prevents styles for the main HeadWord from leaking onto other HeadWords -->
    <ConfigurationItem name="Headword" isEnabled="true" style="Dictionary-Headword" before="" between=" " after="  " field="MLHeadWord" cssClassNameOverride="mainheadword">
      <WritingSystemOptions writingSystemType="vernacular" displayWSAbreviation="false">
        <Option id="vernacular" isEnabled="true" />
      </WritingSystemOptions>
    </ConfigurationItem>
    <ConfigurationItem name="Lexeme Form" isEnabled="false" before="" between=" " after=" " field="LexemeFormOA" cssClassNameOverride="lexemeform">
      <WritingSystemOptions writingSystemType="vernacular" displayWSAbreviation="false">
        <Option id="vernacular" isEnabled="true" />
      </WritingSystemOptions>
    </ConfigurationItem>
    <ConfigurationItem name="Citation Form" isEnabled="false" before="" between=" " after=" " field="CitationForm">
      <WritingSystemOptions writingSystemType="vernacular" displayWSAbreviation="false">
        <Option id="all vernacular" isEnabled="true" />
      </WritingSystemOptions>
    </ConfigurationItem>
    <ConfigurationItem name="Homograph Number" style="Homograph-Number" isEnabled="false" before="" after=" " field="HomographNumber" />
    <ConfigurationItem name="Pronunciations" isEnabled="true" before="" between=", " after=" " field="PronunciationsOS" cssClassNameOverride="pronunciations">
      <ConfigurationItem name="Pronunciation" isEnabled="true" before="[" between=" " after="] " field="Form">
        <WritingSystemOptions writingSystemType="pronunciation" displayWSAbreviation="false">
          <Option id="pronunciation" isEnabled="true" />
        </WritingSystemOptions>
      </ConfigurationItem>
      <ConfigurationItem name="CV Pattern" isEnabled="false" before="" after=" " field="CVPattern" />
      <ConfigurationItem name="Tone" isEnabled="false" before="" after=" " field="Tone" />
      <ConfigurationItem name="Location" isEnabled="false" style="Dictionary-Contrasting" before="" after=" " field="LocationRA" cssClassNameOverride="location">
        <ConfigurationItem name="Abbreviation" isEnabled="true" before="" between=" " after=" " field="Abbreviation">
          <WritingSystemOptions writingSystemType="both" displayWSAbreviation="false">
            <Option id="analysis" isEnabled="true" />
          </WritingSystemOptions>
        </ConfigurationItem>
        <ConfigurationItem name="Name" isEnabled="false" before="" between=" " after=" " field="Name">
          <WritingSystemOptions writingSystemType="both" displayWSAbreviation="false">
            <Option id="analysis" isEnabled="true" />
          </WritingSystemOptions>
        </ConfigurationItem>
        <ConfigurationItem name="Alias" isEnabled="true" between=" " after=" " field="Alias">
          <WritingSystemOptions writingSystemType="analysis" displayWSAbreviation="false">
            <Option id="analysis" isEnabled="true" />
          </WritingSystemOptions>
        </ConfigurationItem>
      </ConfigurationItem>
      <ConfigurationItem name="PronounciationMedia" after=" " isEnabled="false" field="MediaFilesOS">
        <ConfigurationItem name="MediaFiles" after=" " isEnabled="false" field="MediaFileRA"/>
      </ConfigurationItem>
    </ConfigurationItem>
    <ConfigurationItem name="Etymology" isEnabled="false" before="" after=" " field="EtymologyOA" cssClassNameOverride="etymology">
      <ConfigurationItem name="Etymological Form" isEnabled="true" before="" between=" " after=" " field="Form">
        <WritingSystemOptions writingSystemType="both" displayWSAbreviation="false">
          <Option id="best vernoranal" isEnabled="true" />
        </WritingSystemOptions>
      </ConfigurationItem>
      <ConfigurationItem name="Gloss" isEnabled="true" before="" between=" " after=" " field="Gloss">
        <WritingSystemOptions writingSystemType="analysis" displayWSAbreviation="false">
          <Option id="analysis" isEnabled="true" />
        </WritingSystemOptions>
      </ConfigurationItem>
      <ConfigurationItem name="Comment" isEnabled="true" before="" between=" " after=" " field="Comment">
        <WritingSystemOptions writingSystemType="analysis" displayWSAbreviation="false">
          <Option id="analysis" isEnabled="true" />
        </WritingSystemOptions>
      </ConfigurationItem>
      <ConfigurationItem name="Source" isEnabled="false" before="" after=" " field="Source" />
    </ConfigurationItem>
    <ConfigurationItem name="Senses" isEnabled="true" before="" between="  " after=" " field="SensesOS" cssClassNameOverride="senses">
      <SenseOptions numberStyle="Dictionary-SenseNumber" numberBefore="" numberingStyle="%O" numberAfter=") " numberSingleSense="false" showSingleGramInfoFirst="true" displayEachSenseInParagraph="false" />
      <ConfigurationItem name="Grammatical Info." isEnabled="true" style="Dictionary-Contrasting" before="" between="" after=" " field="MorphoSyntaxAnalysisRA" cssClassNameOverride="morphosyntaxanalysis">
        <ConfigurationItem name="Category Info." isEnabled="true" style="Classified-POS" before="" between=" " after=" " field="MLPartOfSpeech">
          <WritingSystemOptions writingSystemType="analysis" displayWSAbreviation="false">
            <Option id="analysis" isEnabled="true" />
          </WritingSystemOptions>
        </ConfigurationItem>
        <ConfigurationItem name="Slots (for Infl. Affixes)" isEnabled="false" before=": " between=", " after="" field="Slots">
          <WritingSystemOptions writingSystemType="analysis" displayWSAbreviation="false">
            <Option id="analysis" isEnabled="true" />
          </WritingSystemOptions>
          <ConfigurationItem name="Slot Names" isEnabled="true" before="" between=" " after=" " field="Name">
            <WritingSystemOptions writingSystemType="analysis" displayWSAbreviation="false">
              <Option id="analysis" isEnabled="true" />
            </WritingSystemOptions>
          </ConfigurationItem>
        </ConfigurationItem>
        <ConfigurationItem name="Inflection Class" isEnabled="false" before="" between=" " after=" " field="MLInflectionClass">
          <WritingSystemOptions writingSystemType="analysis" displayWSAbreviation="false">
            <Option id="analysis" isEnabled="true" />
          </WritingSystemOptions>
        </ConfigurationItem>
        <ConfigurationItem name="Inflection Features" isEnabled="false" before="" after=" " field="FeaturesTSS" cssClassNameOverride="inflectionfeatures" />
        <ConfigurationItem name="Exception Features" isEnabled="false" before="" after=" " field="ExceptionFeaturesTSS" cssClassNameOverride="exceptionfeatures" />
        <ConfigurationItem name="Gram Info (Name)" isEnabled="false" between=" " after=" " field="InterlinearNameTSS" cssClassNameOverride="graminfoname" />
        <ConfigurationItem name="Gram Info (Abbrev)" isEnabled="false" between=" " after=" " field="InterlinearAbbrTSS" cssClassNameOverride="graminfoabbrev" />
      </ConfigurationItem>
      <ConfigurationItem name="Sense Type" isEnabled="false" style="Dictionary-Contrasting" before="(" after=") " field="SenseTypeRA" cssClassNameOverride="sensetype">
        <ConfigurationItem name="Abbreviation" isEnabled="true" before="" between=" " after="" field="Abbreviation">
          <WritingSystemOptions writingSystemType="analysis" displayWSAbreviation="false">
            <Option id="analysis" isEnabled="true" />
          </WritingSystemOptions>
        </ConfigurationItem>
        <ConfigurationItem name="Name" isEnabled="false" before="" between=" " after="" field="Name">
          <WritingSystemOptions writingSystemType="analysis" displayWSAbreviation="false">
            <Option id="analysis" isEnabled="true" />
          </WritingSystemOptions>
        </ConfigurationItem>
      </ConfigurationItem>
      <ConfigurationItem name="Definition (or Gloss)" isEnabled="false" before="" between=" " after=" " field="DefinitionOrGloss">
        <WritingSystemOptions writingSystemType="analysis" displayWSAbreviation="false">
          <Option id="all analysis" isEnabled="true" />
        </WritingSystemOptions>
      </ConfigurationItem>
      <ConfigurationItem name="Definition" isEnabled="true" before="" between=" " after=" " field="Definition">
        <WritingSystemOptions writingSystemType="analysis" displayWSAbreviation="false">
          <Option id="all analysis" isEnabled="true" />
        </WritingSystemOptions>
      </ConfigurationItem>
      <ConfigurationItem name="Restrictions" isEnabled="true" style="Dictionary-Contrasting" before="(" between=" " after=") " field="Restrictions">
        <WritingSystemOptions writingSystemType="analysis" displayWSAbreviation="false">
          <Option id="all analysis" isEnabled="true" />
        </WritingSystemOptions>
      </ConfigurationItem>
      <ConfigurationItem name="Scientific Name" isEnabled="true" style="Dictionary-Contrasting" before="[" after="] " field="ScientificName" />
      <ConfigurationItem name="Gloss" isEnabled="false" before="" between=" " after=" " field="Gloss">
        <WritingSystemOptions writingSystemType="analysis" displayWSAbreviation="false">
          <Option id="all analysis" isEnabled="true" />
        </WritingSystemOptions>
      </ConfigurationItem>